{
  "schemaVersion": "1.0.0",
  "lastUpdated": "2026-08-14T14:56:36Z",
  "contentVersion": "2026.08.14.6",
  "minAppVersion": "1.0.0",
  "files": [
    {
      "path": "syllabus/tier1.json",
      "kind": "syllabus",
      "sizeBytes": 19111,
      "checksum": "ad2ec539d26f4bd16160ac417533e5d0b4e7d7bb4a903011fb38b6fd3ed3750d",
      "lastModified": "2026-08-13T16:15:21Z",
      "required": true
    },
    {
      "path": "tier1/english.json",
      "kind": "question_bank",
      "sizeBytes": 190589,
      "checksum": "fb608450993ded06397abb79d8085be24f6a5294338d9205347e6289384c1449",
      "lastModified": "2026-08-14T14:56:36Z",
      "required": true
    },
    {
      "path": "tier1/gk.json",
      "kind": "question_bank",
      "sizeBytes": 241067,
      "checksum": "73a51db8f3fa791d2574e1fcd2d572a201886028ff3a7477a21947e7a74f1b3e",
      "lastModified": "2026-08-14T14:56:36Z",
      "required": true
    },
    {
      "path": "tier1/quant.json",
      "kind": "question_bank",
      "sizeBytes": 208076,
      "checksum": "6c0d2cfcdfab871a056e3e730fd79537c6f6aa14409b9276e579feeed2f75548",
      "lastModified": "2026-08-14T14:56:36Z",
      "required": true
    },
    {
      "path": "tier1/reasoning.json",
      "kind": "question_bank",
      "sizeBytes": 215620,
      "checksum": "f3de003bde241443aa56b0e85fcb92205dc98b63d4a6fd90955818faa88dc5cd",
      "lastModified": "2026-08-14T14:56:36Z",
      "required": true
    },
    {
      "path": "mocks/tier1/t1_mock_001.json",
      "kind": "mock",
      "sizeBytes": 5229,
      "checksum": "24a845dd1408f26c4539a4dd18457299ebbe973780403fa1a6278bf10a644d65",
      "lastModified": "2026-08-14T14:56:36Z",
      "required": false
    },
    {
      "path": "mocks/tier1/t1_mock_002.json",
      "kind": "mock",
      "sizeBytes": 5229,
      "checksum": "ac388c7ad43a6f14f64279a90dc3e8d8aeec7ec08608c15986bd7379c2f44eef",
      "lastModified": "2026-08-14T14:56:36Z",
      "required": false
    },
    {
      "path": "pyq/2021_tier1.json",
      "kind": "pyq",
      "sizeBytes": 5556,
      "checksum": "fed40ce5269fa37d2b6ae48fe996900934968e6f64e5333b91295fa0c9e47ba1",
      "lastModified": "2026-08-14T14:56:36Z",
      "required": false
    },
    {
      "path": "pyq/2022_tier1.json",
      "kind": "pyq",
      "sizeBytes": 5554,
      "checksum": "d46a7950317d246ed91d5c27ef9536479a9b647a64e832bd616f33b70baa6934",
      "lastModified": "2026-08-14T14:56:36Z",
      "required": false
    },
    {
      "path": "pyq/2023_tier1.json",
      "kind": "pyq",
      "sizeBytes": 5552,
      "checksum": "876b9be30c4aa19608ec2d99d5c0ed0f02df25b4d52d8796baac02b6641aaa1e",
      "lastModified": "2026-08-14T14:56:36Z",
      "required": false
    },
    {
      "path": "pyq/2024_tier1.json",
      "kind": "pyq",
      "sizeBytes": 5554,
      "checksum": "b26326f0776b2a3fab03674eb26927b3236bf5355629c07e3de72d3994cabeba",
      "lastModified": "2026-08-14T14:56:36Z",
      "required": false
    },
    {
      "path": "current_affairs/2026_08.json",
      "kind": "current_affairs",
      "sizeBytes": 4600,
      "checksum": "0f51c811727f3758e3d7353631279cd0a4e926ede0da8a5cc0ae23a61c27f5bb",
      "lastModified": "2026-08-14T12:24:57Z",
      "required": false
    },
    {
      "path": "current_affairs/latest.json",
      "kind": "current_affairs",
      "sizeBytes": 4600,
      "checksum": "0f51c811727f3758e3d7353631279cd0a4e926ede0da8a5cc0ae23a61c27f5bb",
      "lastModified": "2026-08-14T12:24:57Z",
      "required": true
    },
    {
      "path": "formula_sheets/quant_formulas.json",
      "kind": "formula_sheet",
      "sizeBytes": 21046,
      "checksum": "4cdb79d582b59e7a3664eee00bb9b21105b7bbb790d459dbc8394d031af6d858",
      "lastModified": "2026-08-14T14:56:36Z",
      "required": true
    }
  ],
  "totalSizeBytes": 937383,
  "forceUpdate": false,
  "changelog": "Content update."
}
